{
  "schema_version": 1,
  "source_corpus_path": "research/question_engine/smart_analysis_corpus_v1.json",
  "source_git_blob_sha": "15bb98267d1baf3b380e7a9f1e5e7bfaa6d7d23a",
  "cases": [
    {
      "case_id": "em_security_broad_trigger_confirmed",
      "source_case_id": "security_broad_trigger_confirmed",
      "source_basis": "synthetic_from_observed_pattern",
      "error_origin": "CONSTRUCTED_WRONG_READING",
      "template_family": "broad_realization",
      "split": "train",
      "review": {
        "status": "UNVERIFIED",
        "reviewer_ref": null,
        "review_evidence_refs": []
      },
      "spans": [
        {
          "ref": "c1",
          "text_he": "המשכיר רשאי לממש את שיק הביטחון במקרה של כל הפרה של ההסכם."
        },
        {
          "ref": "c6",
          "text_he": "השוכר ישמור על ניקיון המושכר במשך תקופת השכירות."
        }
      ],
      "mechanisms": [
        {
          "mechanism_id": "security_1",
          "anchor_ref": "c1"
        }
      ],
      "facts": [
        {
          "question_id": "security.realization_chain",
          "field": "realization_grounds",
          "expected": "any_contract_breach",
          "refs": [
            "c1"
          ],
          "mechanism_id": "security_1"
        },
        {
          "question_id": "security.realization_chain",
          "field": "notice_required",
          "expected": false,
          "refs": [
            "@scope"
          ],
          "mechanism_id": "security_1"
        },
        {
          "question_id": "security.realization_chain",
          "field": "cure_available",
          "expected": false,
          "refs": [
            "@scope"
          ],
          "mechanism_id": "security_1"
        }
      ],
      "links": [],
      "wrong_reading": {
        "text": "The cheque is restricted to unpaid rent only.",
        "refs": [
          "c1"
        ]
      },
      "corrected_reading": {
        "text": "The synthetic clause allows realization for any breach; within the declared complete scope no notice or cure is stated.",
        "refs": [
          "c1",
          "@scope"
        ]
      },
      "discriminator": {
        "text": "The all-breaches wording and declared complete realization-chain scope.",
        "refs": [
          "c1",
          "@scope"
        ]
      }
    },
    {
      "case_id": "em_security_broad_trigger_narrowed_by_notice_cure",
      "source_case_id": "security_broad_trigger_narrowed_by_notice_cure",
      "source_basis": "synthetic_from_observed_pattern",
      "error_origin": "CONSTRUCTED_WRONG_READING",
      "template_family": "broad_realization",
      "split": "train",
      "review": {
        "status": "UNVERIFIED",
        "reviewer_ref": null,
        "review_evidence_refs": []
      },
      "spans": [
        {
          "ref": "c1",
          "text_he": "המשכיר רשאי לממש את שיק הביטחון במקרה של כל הפרה של ההסכם."
        },
        {
          "ref": "c6",
          "text_he": "השוכר ישמור על ניקיון המושכר במשך תקופת השכירות."
        },
        {
          "ref": "c9",
          "text_he": "מימוש שיק הביטחון ייעשה רק לאחר התראה בכתב של 14 ימים ומתן אפשרות לשוכר לתקן את ההפרה בתוך אותה תקופה."
        }
      ],
      "mechanisms": [
        {
          "mechanism_id": "security_1",
          "anchor_ref": "c1"
        }
      ],
      "facts": [
        {
          "question_id": "security.realization_chain",
          "field": "realization_grounds",
          "expected": "any_contract_breach",
          "refs": [
            "c1"
          ],
          "mechanism_id": "security_1"
        },
        {
          "question_id": "security.realization_chain",
          "field": "notice_required",
          "expected": true,
          "refs": [
            "c9"
          ],
          "mechanism_id": "security_1"
        },
        {
          "question_id": "security.realization_chain",
          "field": "notice_period",
          "expected": 14,
          "refs": [
            "c9"
          ],
          "mechanism_id": "security_1"
        },
        {
          "question_id": "security.realization_chain",
          "field": "cure_available",
          "expected": true,
          "refs": [
            "c9"
          ],
          "mechanism_id": "security_1"
        },
        {
          "question_id": "security.realization_chain",
          "field": "cure_period",
          "expected": 14,
          "refs": [
            "c9"
          ],
          "mechanism_id": "security_1"
        }
      ],
      "links": [
        {
          "mechanism_id": "security_1",
          "from_ref": "c1",
          "to_ref": "c9",
          "kind": "QUALIFIES"
        }
      ],
      "wrong_reading": {
        "text": "The cheque can be realized immediately for any breach.",
        "refs": [
          "c1"
        ]
      },
      "corrected_reading": {
        "text": "The broad trigger is subject to written 14-day notice and an opportunity to cure in c9.",
        "refs": [
          "c1",
          "c9"
        ]
      },
      "discriminator": {
        "text": "The later clause expressly attaches both safeguards to this same cheque.",
        "refs": [
          "c1",
          "c9"
        ]
      }
    },
    {
      "case_id": "em_security_generic_trigger_cleared_by_specific_limit",
      "source_case_id": "security_generic_trigger_cleared_by_specific_limit",
      "source_basis": "synthetic_boundary_case",
      "error_origin": "CONSTRUCTED_WRONG_READING",
      "template_family": "broad_realization",
      "split": "train",
      "review": {
        "status": "UNVERIFIED",
        "reviewer_ref": null,
        "review_evidence_refs": []
      },
      "spans": [
        {
          "ref": "c1",
          "text_he": "המשכיר רשאי לממש את הבטוחה במקרה של כל הפרה של ההסכם."
        },
        {
          "ref": "c8",
          "text_he": "השוכר יודיע למשכיר על תקלה דחופה ללא דיחוי."
        },
        {
          "ref": "c12",
          "text_he": "למרות האמור לעיל, ניתן לממש את הבטוחה רק בגין דמי שכירות שלא שולמו ולאחר התראה בכתב של 14 ימים."
        }
      ],
      "mechanisms": [
        {
          "mechanism_id": "security_1",
          "anchor_ref": "c1"
        }
      ],
      "facts": [
        {
          "question_id": "security.realization_chain",
          "field": "realization_grounds",
          "expected": "unpaid_rent_only",
          "refs": [
            "c12"
          ],
          "mechanism_id": "security_1"
        },
        {
          "question_id": "security.realization_chain",
          "field": "notice_required",
          "expected": true,
          "refs": [
            "c12"
          ],
          "mechanism_id": "security_1"
        },
        {
          "question_id": "security.realization_chain",
          "field": "notice_period",
          "expected": 14,
          "refs": [
            "c12"
          ],
          "mechanism_id": "security_1"
        }
      ],
      "links": [
        {
          "mechanism_id": "security_1",
          "from_ref": "c1",
          "to_ref": "c12",
          "kind": "QUALIFIES"
        }
      ],
      "wrong_reading": {
        "text": "The general clause permits realization for every breach.",
        "refs": [
          "c1"
        ]
      },
      "corrected_reading": {
        "text": "The specific exception limits realization to unpaid rent after 14 days' written notice.",
        "refs": [
          "c1",
          "c12"
        ]
      },
      "discriminator": {
        "text": "The explicit notwithstanding exception narrows the generic trigger.",
        "refs": [
          "c1",
          "c12"
        ]
      }
    },
    {
      "case_id": "em_multiple_security_instruments_keep_identity",
      "source_case_id": "multiple_security_instruments_keep_identity",
      "source_basis": "synthetic_from_observed_pattern",
      "error_origin": "CONSTRUCTED_WRONG_READING",
      "template_family": "multiple_instruments",
      "split": "evaluation",
      "review": {
        "status": "UNVERIFIED",
        "reviewer_ref": null,
        "review_evidence_refs": []
      },
      "spans": [
        {
          "ref": "c3",
          "text_he": "השוכר ימסור שיק ביטחון על סך 10,000 ש״ח ללא תאריך."
        },
        {
          "ref": "c4",
          "text_he": "בנוסף יימסר שטר חוב על סך 30,000 ש״ח שמועדו 01.01.2027."
        },
        {
          "ref": "c20",
          "text_he": "המשכיר יהיה רשאי להיכנס למושכר בתיאום מראש."
        }
      ],
      "mechanisms": [
        {
          "mechanism_id": "security_1",
          "anchor_ref": "c3"
        },
        {
          "mechanism_id": "security_2",
          "anchor_ref": "c4"
        }
      ],
      "facts": [
        {
          "question_id": "security.instrument_inventory",
          "field": "instrument_types",
          "expected": "security_cheque",
          "refs": [
            "c3"
          ],
          "mechanism_id": "security_1"
        },
        {
          "question_id": "security.instrument_inventory",
          "field": "instrument_types",
          "expected": "promissory_note",
          "refs": [
            "c4"
          ],
          "mechanism_id": "security_2"
        },
        {
          "question_id": "security.instrument_inventory",
          "field": "instrument_count",
          "expected": 2,
          "refs": [
            "c3",
            "c4"
          ]
        },
        {
          "question_id": "security.instrument_relationship",
          "field": "simultaneous_instruments",
          "expected": [
            "security_1",
            "security_2"
          ],
          "refs": [
            "c3",
            "c4"
          ]
        },
        {
          "question_id": "security.instrument_amounts",
          "field": "instrument_amounts",
          "expected": 10000,
          "refs": [
            "c3"
          ],
          "mechanism_id": "security_1"
        },
        {